{"chunk_index": 0, "n_chunks": 1, "n_items_total": 50, "items": [{"id_contrato": "FIXTURE-0018", "nit_entidad": "900111001", "nombre_entidad": "ALCALDÍA DE MEDELLÍN", "doc_proveedor": "800999004", "nombre_proveedor": "PROVEEDOR EJEMPLO 4 SAS", "cod_dpto": "05", "dpto": "ANTIOQUIA", "cod_mpio": "05001", "municipio": "MEDELLÍN", "modalidad": "SELECCION_ABREVIADA", "anio": 2021, "valor_contrato": 950000000.0, "fecha_firma": "2021-12-22", "source": "SECOP2", "score": 90.0, "tier": "critico", "urlproceso": "https://community.secop.gov.co/Public/Tendering/OpportunityDetail/Index?noticeUID=FIXTURE-0018", "n_flags_aplicables": 4, "n_flags_disparados": 4, "banderas": [{"flag_id": "F05", "nombre": "Fraccionamiento", "peso": 12, "evidence": {"nota": "evidencia sintetica de fixture"}}, {"flag_id": "F06", "nombre": "Carrusel", "peso": 12, "evidence": {"nota": "evidencia sintetica de fixture"}}, {"flag_id": "F07", "nombre": "Ventana de licitación corta", "peso": 8, "evidence": {"nota": "evidencia sintetica de fixture"}}, {"flag_id": "F08", "nombre": "Precio calcado", "peso": 6, "evidence": {"nota": "evidencia sintetica de fixture"}}]}, {"id_contrato": "FIXTURE-0038", "nit_entidad": "900111003", "nombre_entidad": "ALCALDÍA DE BOGOTÁ", "doc_proveedor": "800999009", "nombre_proveedor": "PROVEEDOR EJEMPLO 9 SAS", "cod_dpto": "11", "dpto": "BOGOTÁ, D.C.", "cod_mpio": "11001", "municipio": "BOGOTÁ, D.C.", "modalidad": "SELECCION_ABREVIADA", "anio": 2023, "valor_contrato": 950000000.0, "fecha_firma": "2023-06-12", "source": "SECOP2", "score": 90.0, "tier": "critico", "urlproceso": "https://community.secop.gov.co/Public/Tendering/OpportunityDetail/Index?noticeUID=FIXTURE-0038", "n_flags_aplicables": 4, "n_flags_disparados": 4, "banderas": [{"flag_id": "F11", "nombre": "Proveedor sancionado", "peso": 20, "evidence": {"n_sanciones_antes_firma": 1, "fuentes_antes_firma": ["CGR"]}}, {"flag_id": "F12", "nombre": "Concentración/dependencia", "peso": 8, "evidence": {"nota": "evidencia sintetica de fixture"}}, {"flag_id": "F13", "nombre": "Objeto vago", "peso": 3, "evidence": {"objeto_len": 18}}, {"flag_id": "F14", "nombre": "Valor redondo", "peso": 2, "evidence": {"valor_contrato": 1200000000}}]}, {"id_contrato": "FIXTURE-0008", "nit_entidad": "900111003", "nombre_entidad": "ALCALDÍA DE BOGOTÁ", "doc_proveedor": "800999009", "nombre_proveedor": "PROVEEDOR EJEMPLO 9 SAS", "cod_dpto": "11", "dpto": "BOGOTÁ, D.C.", "cod_mpio": "11001", "municipio": "BOGOTÁ, D.C.", "modalidad": "LICITACION_PUBLICA", "anio": 2023, "valor_contrato": 450000000.0, "fecha_firma": "2023-06-09", "source": "SECOP2", "score": 90.0, "tier": "critico", "urlproceso": "https://community.secop.gov.co/Public/Tendering/OpportunityDetail/Index?noticeUID=FIXTURE-0008", "n_flags_aplicables": 4, "n_flags_disparados": 4, "banderas": [{"flag_id": "F09", "nombre": "Afán de diciembre", "peso": 8, "evidence": {"fecha_firma": "2022-12-22"}}, {"flag_id": "F10", "nombre": "Ventana electoral", "peso": 6, "evidence": {"nota": "evidencia sintetica de fixture"}}, {"flag_id": "F11", "nombre": "Proveedor sancionado", "peso": 20, "evidence": {"n_sanciones_antes_firma": 1, "fuentes_antes_firma": ["CGR"]}}, {"flag_id": "F12", "nombre": "Concentración/dependencia", "peso": 8, "evidence": {"nota": "evidencia sintetica de fixture"}}]}, {"id_contrato": "FIXTURE-0028", "nit_entidad": "900111005", "nombre_entidad": "ALCALDÍA DE BUENAVENTURA", "doc_proveedor": "8009990014", "nombre_proveedor": "PROVEEDOR EJEMPLO 14 SAS", "cod_dpto": "76", "dpto": "VALLE DEL CAUCA", "cod_mpio": "76109", "municipio": "BUENAVENTURA", "modalidad": "LICITACION_PUBLICA", "anio": 2022, "valor_contrato": 450000000.0, "fecha_firma": "2022-06-02", "source": "SECOP2", "score": 90.0, "tier": "critico", "urlproceso": "https://community.secop.gov.co/Public/Tendering/OpportunityDetail/Index?noticeUID=FIXTURE-0028", "n_flags_aplicables": 4, "n_flags_disparados": 4, "banderas": [{"flag_id": "F01", "nombre": "Único oferente", "peso": 15, "evidence": {"num_oferentes_unicos": 1, "modalidad_norm": "LICITACION_PUBLICA"}}, {"flag_id": "F02", "nombre": "Empresa exprés", "peso": 15, "evidence": {"fecha_matricula": "2023-01-15", "dias_antes_publicacion": 45}}, {"flag_id": "F03", "nombre": "Adiciones excesivas", "peso": 12, "evidence": {"dias_adicionados": 200, "duracion_dias_inicial": 300, "f03_tiempo": true}}, {"flag_id": "F04", "nombre": "Abuso de contratación directa", "peso": 8, "evidence": {"nota": "evidencia sintetica de fixture"}}]}, {"id_contrato": "FIXTURE-0048", "nit_entidad": "900111001", "nombre_entidad": "ALCALDÍA DE MEDELLÍN", "doc_proveedor": "800999004", "nombre_proveedor": "PROVEEDOR EJEMPLO 4 SAS", "cod_dpto": "05", "dpto": "ANTIOQUIA", "cod_mpio": "05001", "municipio": "MEDELLÍN", "modalidad": "LICITACION_PUBLICA", "anio": 2021, "valor_contrato": 450000000.0, "fecha_firma": "2021-06-22", "source": "SECOP2", "score": 90.0, "tier": "critico", "urlproceso": "https://community.secop.gov.co/Public/Tendering/OpportunityDetail/Index?noticeUID=FIXTURE-0048", "n_flags_aplicables": 4, "n_flags_disparados": 4, "banderas": [{"flag_id": "F07", "nombre": "Ventana de licitación corta", "peso": 8, "evidence": {"nota": "evidencia sintetica de fixture"}}, {"flag_id": "F08", "nombre": "Precio calcado", "peso": 6, "evidence": {"nota": "evidencia sintetica de fixture"}}, {"flag_id": "F09", "nombre": "Afán de diciembre", "peso": 8, "evidence": {"fecha_firma": "2022-12-22"}}, {"flag_id": "F10", "nombre": "Ventana electoral", "peso": 6, "evidence": {"nota": "evidencia sintetica de fixture"}}]}, {"id_contrato": "FIXTURE-0017", "nit_entidad": "900111006", "nombre_entidad": "ALCALDÍA DE SOACHA", "doc_proveedor": "800999003", "nombre_proveedor": "PROVEEDOR EJEMPLO 3 SAS", "cod_dpto": "25", "dpto": "CUNDINAMARCA", "cod_mpio": "25754", "municipio": "SOACHA", "modalidad": "CONTRATACION_DIRECTA", "anio": 2023, "valor_contrato": 900000000.0, "fecha_firma": "2023-06-18", "source": "SECOP2", "score": 78.0, "tier": "critico", "urlproceso": "https://community.secop.gov.co/Public/Tendering/OpportunityDetail/Index?noticeUID=FIXTURE-0017", "n_flags_aplicables": 5, "n_flags_disparados": 5, "banderas": [{"flag_id": "F04", "nombre": "Abuso de contratación directa", "peso": 8, "evidence": {"nota": "evidencia sintetica de fixture"}}, {"flag_id": "F05", "nombre": "Fraccionamiento", "peso": 12, "evidence": {"nota": "evidencia sintetica de fixture"}}, {"flag_id": "F06", "nombre": "Carrusel", "peso": 12, "evidence": {"nota": "evidencia sintetica de fixture"}}, {"flag_id": "F07", "nombre": "Ventana de licitación corta", "peso": 8, "evidence": {"nota": "evidencia sintetica de fixture"}}, {"flag_id": "F08", "nombre": "Precio calcado", "peso": 6, "evidence": {"nota": "evidencia sintetica de fixture"}}]}, {"id_contrato": "FIXTURE-0037", "nit_entidad": "900111002", "nombre_entidad": "GOBERNACIÓN DE ANTIOQUIA", "doc_proveedor": "800999008", "nombre_proveedor": "PROVEEDOR EJEMPLO 8 SAS", "cod_dpto": "05", "dpto": "ANTIOQUIA", "cod_mpio": "05001", "municipio": "MEDELLÍN", "modalidad": "CONTRATACION_DIRECTA", "anio": 2022, "valor_contrato": 900000000.0, "fecha_firma": "2022-06-11", "source": "SECOP2", "score": 78.0, "tier": "critico", "urlproceso": "https://community.secop.gov.co/Public/Tendering/OpportunityDetail/Index?noticeUID=FIXTURE-0037", "n_flags_aplicables": 5, "n_flags_disparados": 5, "banderas": [{"flag_id": "F10", "nombre": "Ventana electoral", "peso": 6, "evidence": {"nota": "evidencia sintetica de fixture"}}, {"flag_id": "F11", "nombre": "Proveedor sancionado", "peso": 20, "evidence": {"n_sanciones_antes_firma": 1, "fuentes_antes_firma": ["CGR"]}}, {"flag_id": "F12", "nombre": "Concentración/dependencia", "peso": 8, "evidence": {"nota": "evidencia sintetica de fixture"}}, {"flag_id": "F13", "nombre": "Objeto vago", "peso": 3, "evidence": {"objeto_len": 18}}, {"flag_id": "F14", "nombre": "Valor redondo", "peso": 2, "evidence": {"valor_contrato": 1200000000}}]}, {"id_contrato": "FIXTURE-0007", "nit_entidad": "900111002", "nombre_entidad": "GOBERNACIÓN DE ANTIOQUIA", "doc_proveedor": "800999008", "nombre_proveedor": "PROVEEDOR EJEMPLO 8 SAS", "cod_dpto": "05", "dpto": "ANTIOQUIA", "cod_mpio": "05001", "municipio": "MEDELLÍN", "modalidad": "MINIMA_CUANTIA", "anio": 2022, "valor_contrato": 400000000.0, "fecha_firma": "2022-06-08", "source": "SECOP2", "score": 78.0, "tier": "critico", "urlproceso": "https://community.secop.gov.co/Public/Tendering/OpportunityDetail/Index?noticeUID=FIXTURE-0007", "n_flags_aplicables": 5, "n_flags_disparados": 5, "banderas": [{"flag_id": "F08", "nombre": "Precio calcado", "peso": 6, "evidence": {"nota": "evidencia sintetica de fixture"}}, {"flag_id": "F09", "nombre": "Afán de diciembre", "peso": 8, "evidence": {"fecha_firma": "2022-12-22"}}, {"flag_id": "F10", "nombre": "Ventana electoral", "peso": 6, "evidence": {"nota": "evidencia sintetica de fixture"}}, {"flag_id": "F11", "nombre": "Proveedor sancionado", "peso": 20, "evidence": {"n_sanciones_antes_firma": 1, "fuentes_antes_firma": ["CGR"]}}, {"flag_id": "F12", "nombre": "Concentración/dependencia", "peso": 8, "evidence": {"nota": "evidencia sintetica de fixture"}}]}, {"id_contrato": "FIXTURE-0027", "nit_entidad": "900111004", "nombre_entidad": "ALCALDÍA DE CALI", "doc_proveedor": "8009990013", "nombre_proveedor": "PROVEEDOR EJEMPLO 13 SAS", "cod_dpto": "76", "dpto": "VALLE DEL CAUCA", "cod_mpio": "76001", "municipio": "CALI", "modalidad": "MINIMA_CUANTIA", "anio": 2021, "valor_contrato": 400000000.0, "fecha_firma": "2021-12-22", "source": "SECOP2", "score": 78.0, "tier": "critico", "urlproceso": "https://community.secop.gov.co/Public/Tendering/OpportunityDetail/Index?noticeUID=FIXTURE-0027", "n_flags_aplicables": 5, "n_flags_disparados": 5, "banderas": [{"flag_id": "F14", "nombre": "Valor redondo", "peso": 2, "evidence": {"valor_contrato": 1200000000}}, {"flag_id": "F01", "nombre": "Único oferente", "peso": 15, "evidence": {"num_oferentes_unicos": 1, "modalidad_norm": "LICITACION_PUBLICA"}}